_id,name,category,url,local_path
796b86ed-8ec2-4764-8516-1a3632f1ec23,white and blue passenger plane under blue sky during daytime,Download this free HD photo of blue,https://images.unsplash.com/photo-1602438458346-f2d6e58adbb4?q=80&w=2000&auto=format&fit=crop&ixlib=rb-4.0.3&ixid=M3wxMjA3fDB8MHxwaG90by1wYWdlfHx8fGVufDB8fHx8fA%3D%3D,full/f874c62beb20c87258ea3abdba4f5a6a8c547958.jpg
a1b89c31-44f0-4618-9122-b4b899ecbc51,white and blue passenger plane,Download this free HD photo of москва,https://images.unsplash.com/photo-1602438458092-12c3d9a7e195?q=80&w=3008&auto=format&fit=crop&ixlib=rb-4.0.3&ixid=M3wxMjA3fDB8MHxwaG90by1wYWdlfHx8fGVufDB8fHx8fA%3D%3D,full/e139198ec3066013fccba5d2ba18ea64d70962a0.jpg
55ecefe1-5d0b-4cfa-811b-24d12d069fe8,white space needle tower under blue sky during daytime,Download this free HD photo of blue,https://images.unsplash.com/photo-1602438458059-03c21c60dea0?q=80&w=2000&auto=format&fit=crop&ixlib=rb-4.0.3&ixid=M3wxMjA3fDB8MHxwaG90by1wYWdlfHx8fGVufDB8fHx8fA%3D%3D,full/2b6b28b4ff4f4492f177cb290ac37c1b04dfc3e9.jpg
a2296111-6847-4335-ab89-97d4339ba654,a night sky with a lot of stars,Download this free HD photo of свет,https://images.unsplash.com/photo-1636492085519-3b08543e1584?q=80&w=7680&auto=format&fit=crop&ixlib=rb-4.0.3&ixid=M3wxMjA3fDB8MHxwaG90by1wYWdlfHx8fGVufDB8fHx8fA%3D%3D,full/a4b6eab614fa0333dd0d8d692afc317d93085e02.jpg
732c64ee-9691-4c40-9a67-f5d54ed31d99,an underground subway station with stairs leading up to it,Subway on the Mars,https://images.unsplash.com/photo-1553538435-cb923cf2d82a?q=80&w=4032&auto=format&fit=crop&ixlib=rb-4.0.3&ixid=M3wxMjA3fDB8MHxwaG90by1wYWdlfHx8fGVufDB8fHx8fA%3D%3D,full/69e21363f42e90addcde6b758eac3d64ddb19a13.jpg
3810a30b-bd15-4e18-aab8-e028c206ff0f,white and gray concrete tower under blue sky during daytime,Download this free HD photo of blue,https://images.unsplash.com/photo-1602438458062-e57fd4c10834?q=80&w=2000&auto=format&fit=crop&ixlib=rb-4.0.3&ixid=M3wxMjA3fDB8MHxwaG90by1wYWdlfHx8fGVufDB8fHx8fA%3D%3D,full/a77f1255db7fe8895fcc708a7a4d7a45e765d19d.jpg
f1459544-92e4-4d69-9d1a-9b22152c5a11,a large metal sculpture with a red and black design,Download this free HD photo of вечернее небо,https://images.unsplash.com/photo-1711747705718-37195e059fd6?q=80&w=6960&auto=format&fit=crop&ixlib=rb-4.0.3&ixid=M3wxMjA3fDB8MHxwaG90by1wYWdlfHx8fGVufDB8fHx8fA%3D%3D,full/9d9f13f9fefc68e9d057ef37558334087afff04e.jpg
ce1544d5-a02f-4b6c-bd72-06420417d20d,cluster of stars in the sky,Download this free HD photo of black,https://images.unsplash.com/photo-1475274047050-1d0c0975c63e?q=80&w=5456&auto=format&fit=crop&ixlib=rb-4.0.3&ixid=M3wxMjA3fDB8MHxwaG90by1wYWdlfHx8fGVufDB8fHx8fA%3D%3D,full/350a80408f1753e10bf75e57fd224dac35e94e80.jpg
1a894d62-3dce-4e8b-aef9-4aa4d24533ae,galaxy digital wallpaper,Download this free HD photo of mount fisht,https://images.unsplash.com/photo-1515942479748-a59a935bbef4?q=80&w=3456&auto=format&fit=crop&ixlib=rb-4.0.3&ixid=M3wxMjA3fDB8MHxwaG90by1wYWdlfHx8fGVufDB8fHx8fA%3D%3D,full/d77c4ebb37463e3586f3fa3d9a9bbd56aed0147b.jpg
d2333e74-372a-4f44-81b3-0cc1d3f4093d,man wearing silver suit,Download this free HD photo of acid,https://images.unsplash.com/photo-1577930563685-1defbbf929e8?q=80&w=3758&auto=format&fit=crop&ixlib=rb-4.0.3&ixid=M3wxMjA3fDB8MHxwaG90by1wYWdlfHx8fGVufDB8fHx8fA%3D%3D,full/dc1f8f3c37d82e91cc4d6da99fec1508c2743b57.jpg
883c954e-a9ea-4694-b2c7-6e7cae359e71,the night sky is filled with stars and trees,Download this free HD photo of космос,https://images.unsplash.com/photo-1636492087459-f79507c21024?q=80&w=7680&auto=format&fit=crop&ixlib=rb-4.0.3&ixid=M3wxMjA3fDB8MHxwaG90by1wYWdlfHx8fGVufDB8fHx8fA%3D%3D,full/6ef7ea97916510077897e8b4881eb9c73d9d79c0.jpg
e4e1bf55-0e46-4e21-8e0c-0629a2f81275,the night sky is full of stars and trees,Download this free HD photo of небо,https://images.unsplash.com/photo-1636492086790-69173b70ba9b?q=80&w=7680&auto=format&fit=crop&ixlib=rb-4.0.3&ixid=M3wxMjA3fDB8MHxwaG90by1wYWdlfHx8fGVufDB8fHx8fA%3D%3D,full/bc745f22454c2438b0b2e0c92971242bde335517.jpg
cbd6314c-da0d-4a79-9491-b79f6ade51d1,worms eye view of brown building,Download this free HD photo of россия,https://images.unsplash.com/photo-1621939440482-cc75700a3fc7?q=80&w=3024&auto=format&fit=crop&ixlib=rb-4.0.3&ixid=M3wxMjA3fDB8MHxwaG90by1wYWdlfHx8fGVufDB8fHx8fA%3D%3D,full/584de3628b3b8fd6cc2bf12902d99fe990ad34f1.jpg
50d57696-f252-4927-baac-a5e2a40ab6e0,a couple of people standing next to each other,Download this free HD photo of одесская область,https://images.unsplash.com/photo-1577930547486-ac1b764f3050?q=80&w=4016&auto=format&fit=crop&ixlib=rb-4.0.3&ixid=M3wxMjA3fDB8MHxwaG90by1wYWdlfHx8fGVufDB8fHx8fA%3D%3D,full/7eb5abcb8bed34e9066829f1062c216c5d7cffc7.jpg
f51397a1-b303-4c34-824b-d9bccf5f0ff8,a plane flying in the sky at sunset,Download this free HD photo of volzhsky,https://images.unsplash.com/photo-1705137220506-0e3365e0a703?q=80&w=4640&auto=format&fit=crop&ixlib=rb-4.0.3&ixid=M3wxMjA3fDB8MHxwaG90by1wYWdlfHx8fGVufDB8fHx8fA%3D%3D,full/3fa03b148940a65168cfe3d403b84f9235a26073.jpg
9174aac7-81ee-445b-a1fd-026b0e2d7988,a view of a city from a distance,Download this free HD photo of volzhsky,https://images.unsplash.com/photo-1707580254267-80e3c889c776?q=80&w=6960&auto=format&fit=crop&ixlib=rb-4.0.3&ixid=M3wxMjA3fDB8MHxwaG90by1wYWdlfHx8fGVufDB8fHx8fA%3D%3D,full/586cb0579eda5fbfbb292c68150330bacaca9650.jpg
c3329b25-5a1c-4f04-940a-b72ee9997259,a couple of people that are standing in the street,Download this free HD photo of украина,https://images.unsplash.com/photo-1577930577006-13681568ca2f?q=80&w=4016&auto=format&fit=crop&ixlib=rb-4.0.3&ixid=M3wxMjA3fDB8MHxwaG90by1wYWdlfHx8fGVufDB8fHx8fA%3D%3D,full/0b5108900ae53e03ff260c855be56e4343406326.jpg
